{"projectId": "c83b911b-d2a3-4f25-a3b5-0c9c9792e1c2", "schemaVersion": "1.0.0", "analysisSummary": {"analysisType": "linear_static", "status": "success", "startedAt": "2026-08-14T22:23:37.953720Z", "finishedAt": "2026-08-14T22:23:39.057162Z", "durationMs": 1103.442, "nodeCount": 72, "memberCount": 70, "loadCaseCount": 1, "totalDof": 432, "freeDof": 419, "constrainedDof": 13, "solver": "scipy_sparse"}, "displacements": [{"loadCaseId": "LC1", "nodeId": "013868c7-d265-5a28-b6e5-aea2d88b0dd3", "ux": 0.0, "uy": 0.0, "uz": 0.0, "rx": -5.2301922411487, "ry": 3.05269124537874, "rz": -0.21238550835168052}, {"loadCaseId": "LC1", "nodeId": "17323aa9-8164-533f-b311-263e3766a216", "ux": 5.611397452747754, "uy": 0.0, "uz": 0.0, "rx": -5.0985354995545356, "ry": 3.0526321013247086, "rz": -0.21242532550984994}, {"loadCaseId": "LC1", "nodeId": "8a2298f6-4bb0-569b-b483-ebfceebf5e8d", "ux": 6.936201829045585e-08, "uy": 0.0, "uz": 0.0, "rx": -5.2358671409523865, "ry": -3.0522132137602886, "rz": -0.0052408767253414035}, {"loadCaseId": "LC1", "nodeId": "a84e12c6-472c-5d34-8085-d35f4762ba90", "ux": 5.611397530691806, "uy": 0.0, "uz": 0.0, "rx": -5.104509884725598, "ry": -3.052094925653102, "rz": 0.005651091389552915}, {"loadCaseId": "LC1", "nodeId": "682689b8-25dd-5ddc-984b-b976a0045dfb", "ux": 5.03855941375031e-05, "uy": 0.0, "uz": 0.0, "rx": -3.900827192546444, "ry": -4.635742566196442, "rz": 0.13421588178975907}, {"loadCaseId": "LC1", "nodeId": "32071005-893b-5424-8547-479df7b6765a", "ux": 5.611448219667459, "uy": 0.0, "uz": 0.0, "rx": -4.0157486979850106, "ry": -4.384094407515983, "rz": 0.13946470263665783}, {"loadCaseId": "LC1", "nodeId": "8dbeba99-b811-5da8-8593-655b213a32ec", "ux": 0.8322853233359471, "uy": -0.6892728332834429, "uz": -30.381536546305192, "rx": -5.23020642839821, "ry": 3.009078126659051, "rz": -0.2118676467726142}, {"loadCaseId": "LC1", "nodeId": "e87a2769-adbe-5662-a93e-96c36bafb20a", "ux": 1.6410979987028256, "uy": -1.3681806615551735, "uz": -59.90611470328788, "rx": -5.2302489901467375, "ry": 2.882830002495421, "rz": -0.21031406203541522}, {"loadCaseId": "LC1", "nodeId": "cf991bbf-10d0-5ebe-8322-7b9287c68eaf", "ux": 2.405057283999721, "uy": -2.0263584798032555, "uz": -87.79329673646293, "rx": -5.230319926394284, "ry": 2.6831293368787055, "rz": -0.20772475414008337}, {"loadCaseId": "LC1", "nodeId": "8f762b65-1d6f-502c-8b41-6a378a4b1dee", "ux": 3.105298049656388, "uy": -2.6534412830160465, "uz": -113.35446955125403, "rx": -5.230419237140847, "ry": 2.419158593799807, "rz": -0.20409972308661828}, {"loadCaseId": "LC1", "nodeId": "e7ed48e3-70a7-57f7-ad89-4eb808e0e0dd", "ux": 3.725470778633572, "uy": -3.2390640661816046, "uz": -135.99284469299363, "rx": -5.230546922386428, "ry": 2.100100237249599, "rz": -0.19943896887501988}, {"loadCaseId": "LC1", "nodeId": "cad57473-a0d9-52b6-bf8f-aa68a63e58b6", "ux": 4.251741566422717, "uy": -3.772861824288291, "uz": -155.2034583469231, "rx": -5.230702982131028, "ry": 1.735136731218958, "rz": -0.19374249150528955}, {"loadCaseId": "LC1", "nodeId": "8af66610-9fae-5046-b524-2772a2771437", "ux": 4.672792121046218, "uy": -4.244469552324178, "uz": -170.5731713381925, "rx": -5.230887416374647, "ry": 1.3334505396987595, "rz": -0.18701029097742716}, {"loadCaseId": "LC1", "nodeId": "2db7fa26-e89c-5f49-b4e9-5924996c63af", "ux": 4.979819763057208, "uy": -4.643522245277642, "uz": -181.7806691318607, "rx": -5.231100225117283, "ry": 0.9042241266798996, "rz": -0.17924236729143395}, {"loadCaseId": "LC1", "nodeId": "5b29c8b4-a7f3-5c3d-be53-c44068e744b9", "ux": 5.166537425539728, "uy": -4.959654898136754, "uz": -188.59646183289541, "rx": -5.231341408358938, "ry": 0.4566399561532535, "rz": -0.170438720447308}, {"loadCaseId": "LC1", "nodeId": "8a656662-041a-5a72-a17c-e4f61cdf3553", "ux": 5.2291736541086085, "uy": -5.182502505889885, "uz": -190.88288418617333, "rx": -5.2316109660996135, "ry": -0.00011950789028247755, "rz": -0.16059935044505158}, {"loadCaseId": "LC1", "nodeId": "45d88e99-5a5a-55da-8b3a-570e0ec6ffd7", "ux": 5.16647260690954, "uy": -5.301700063525115, "uz": -188.59409557647982, "rx": -5.231908898339306, "ry": -0.4568718014598545, "rz": -0.14972425728466354}, {"loadCaseId": "LC1", "nodeId": "6a214641-330a-5766-a6ed-6621cca4f30a", "ux": 4.979694054619037, "uy": -5.306882566030751, "uz": -181.776080028509, "rx": -5.232235205078018, "ry": -0.904434460564552, "rz": -0.13781344096614512}, {"loadCaseId": "LC1", "nodeId": "560d2d7b-1e2f-5d88-a89b-18fdec4c0a2d", "ux": 4.67261338044447, "uy": -5.187685008395107, "uz": -170.566646206864, "rx": -5.23258988631575, "ry": -1.3336250212135, "rz": -0.12486690148949742}, {"loadCaseId": "LC1", "nodeId": "703ad71f-18b1-57a4-bff2-892715ebb7c6", "ux": 4.251521580123997, "uy": -4.9337423856062745, "uz": -155.1954274160568, "rx": -5.232972942052499, "ry": -1.735261019415809, "rz": -0.11088463885471911}, {"loadCaseId": "LC1", "nodeId": "f5807284-4ba5-570c-89fb-0fc75d98a48d", "ux": 3.7252252619266977, "uy": -4.534689692652647, "uz": -135.98388160050823, "rx": -5.233384372288266, "ry": -2.1001599911805826, "rz": -0.09586665306181208}, {"loadCaseId": "LC1", "nodeId": "7296b5d8-ac6f-527d-bcd1-f89444b67651", "ux": 3.10504664665238, "uy": -3.980161924522327, "uz": -113.345291344548, "rx": -5.233824177023053, "ry": -2.41913947251696, "rz": -0.07981294411077644}, {"loadCaseId": "LC1", "nodeId": "1708f554-32f2-536f-8c12-71b85ce479ae", "ux": 2.4048235676318157, "uy": -3.2597940762037143, "uz": -87.78476387241493, "rx": -5.2342923562568595, "ry": -2.6830169994339776, "rz": -0.06272351200161164}, {"loadCaseId": "LC1", "nodeId": "d988724d-6dd2-5cb6-ac50-7a33f05ff592", "ux": 1.6409094707264842, "uy": -2.3632211426849095, "uz": -59.89923104825684, "rx": -5.234788909989682, "ry": -2.882610107940785, "rz": -0.044598356734317446}, {"loadCaseId": "LC1", "nodeId": "fda21377-56e9-5581-abfc-ed5cc339aa16", "ux": 0.8321734143288421, "uy": -1.2800781189543051, "uz": -30.377449376130144, "rx": -5.235313838221525, "ry": -3.008736334046512, "rz": -0.025437478308893924}, {"loadCaseId": "LC1", "nodeId": "4029b659-6a04-570a-8cee-ec8fb2d199e0", "ux": 0.3813359225400674, "uy": -0.6636423800391296, "uz": -9.22004088196272, "rx": -5.219075029000837, "ry": -3.071760593138579, "rz": 0.012733549926705168}, {"loadCaseId": "LC1", "nodeId": "00e18dcb-ed9c-56a8-b6bb-eff77336f47e", "ux": 0.667419194554921, "uy": -1.2037413433624395, "uz": -17.987165129954167, "rx": -5.171319635291197, "ry": -3.128136532163456, "rz": 0.02946836094769323}, {"loadCaseId": "LC1", "nodeId": "ae43ffe4-87cd-5fc7-b421-370166bc4e1a", "ux": 0.8699014665363959, "uy": -1.625042520309949, "uz": -25.902579908915015, "rx": -5.097365764912387, "ry": -3.215677997645626, "rz": 0.044963556337628996}, {"loadCaseId": "LC1", "nodeId": "ef6f907c-90bd-54a8-b993-07799d74a756", "ux": 0.9996871138460324, "uy": -1.9329202307817506, "uz": -32.63394393930974, "rx": -5.001978222953362, "ry": -3.3287219563958246, "rz": 0.05921913609657525}, {"loadCaseId": "LC1", "nodeId": "6fd7e2f5-28c7-5a64-85bf-3e87c4c95f91", "ux": 1.0669333060769626, "uy": -2.1333774842377724, "uz": -37.915367497124954, "rx": -4.88992181450301, "ry": -3.461605375224707, "rz": 0.07223510022455748}, {"loadCaseId": "LC1", "nodeId": "75cd443d-2960-54f8-9ba3-5159b0bf7fb3", "ux": 1.0810500070543378, "uy": -2.2330459796984257, "uz": -41.547412413872564, "rx": -4.765961344650324, "ry": -3.6086652209430117, "rz": 0.08401144872157373}, {"loadCaseId": "LC1", "nodeId": "e9429f1b-d885-52d9-bbf4-4de712d50d4a", "ux": 1.0506999748354051, "uy": -2.239186105744565, "uz": -43.39709207658582, "rx": -4.634861618484255, "ry": -3.764238460361419, "rz": 0.09454818158756173}, {"loadCaseId": "LC1", "nodeId": "07597b9d-2959-56f4-a4c5-7d7d0c324946", "ux": 0.983798761709934, "uy": -2.15968694051811, "uz": -43.39787142782434, "rx": -4.5013874410937404, "ry": -3.922662060290655, "rz": 0.10384529882239435}, {"loadCaseId": "LC1", "nodeId": "7d0cb490-57f0-5851-8e81-ad010caa75d3", "ux": 0.8875147142004204, "uy": -2.0030662517221614, "uz": -41.54966696566841, "rx": -4.37030361756765, "ry": -4.0782729875413555, "rz": 0.11190280042596057}, {"loadCaseId": "LC1", "nodeId": "eeada9c8-5dd6-5f29-a4be-546a0c0a34c9", "ux": 0.7682689730617501, "uy": -1.7784704966207252, "uz": -37.91884674372395, "rx": -4.246374952995009, "ry": -4.225408208924266, "rz": 0.1187206863982172}, {"loadCaseId": "LC1", "nodeId": "4f2a7845-f71f-55c1-80a7-7c238d224c21", "ux": 0.6317354732808796, "uy": -1.4956748220382372, "uz": -32.63823037111919, "rx": -4.134366252464758, "ry": -4.358404691250092, "rz": 0.12429895673917468}, {"loadCaseId": "LC1", "nodeId": "5e35edaf-d4c7-58ef-934e-8ba8dbe09996", "ux": 0.4828409440767352, "uy": -1.1650830643595063, "uz": -25.907089012507033, "rx": -4.0390423210658675, "ry": -4.471599401329524, "rz": 0.1286376114488128}, {"loadCaseId": "LC1", "nodeId": "5b9a2c14-3220-5697-8736-fabb3965340d", "ux": 0.3257649089002488, "uy": -0.7977277495297429, "uz": -17.991145388062908, "rx": -3.965167963887218, "ry": -4.559329305973243, "rz": 0.13173665052711697}, {"loadCaseId": "LC1", "nodeId": "b19c6f0f-0b60-5690-a027-057cccc4666c", "ux": 0.16393968543441972, "uy": -0.4052700930545924, "uz": -9.222573773486006, "rx": -3.917507986017764, "ry": -4.615931371991987, "rz": 0.13359607397409953}, {"loadCaseId": "LC1", "nodeId": "8986ea0d-5282-5814-be43-c489fbf45166", "ux": 6.44366661401353, "uy": -0.72564829978167, "uz": -30.380946584354525, "rx": -5.098550435517464, "ry": 3.0090194261854375, "rz": -0.21188013446760084}, {"loadCaseId": "LC1", "nodeId": "add75e26-a1b8-5752-b5aa-098150f98358", "ux": 7.252463370355342, "uy": -1.4403845950554115, "uz": -59.90494365099492, "rx": -5.098595243406247, "ry": 2.882772632763065, "rz": -0.2102445613408539}, {"loadCaseId": "LC1", "nodeId": "08374f89-f3e3-5e8a-a519-399ab1e50040", "ux": 8.016407222717383, "uy": -2.1332968813130777, "uz": -87.79156233704455, "rx": -5.098669923220885, "ry": 2.683074185048464, "rz": -0.20751860612960854}, {"loadCaseId": "LC1", "nodeId": "f294597f-7e69-598c-bd2f-1d1bd2f43e8d",